Type,DSI Name
Clinical-driven,"Stanford Univ, Dept Biomed Data Sci"
Clinical-driven,"Beihang Univ, Beijing Adv Innovat Ctr Big Data Based Precis Med"
Clinical-driven,"Univ Oxford, Big Data Inst"
Clinical-driven,"Leiden Univ, Dept Biomed Data Sci"
Clinical-driven,"Dana Farber Canc Inst, Dept Data Sci"
Clinical-driven,"Wake Forest Sch Med, Dept Biostat & Data Sci"
Clinical-driven,"Univ Texas Southwestern Med Ctr Dallas, Dept Populat & Data Sci"
Clinical-driven,"Geisel Sch Med Dartmouth, Dept Biomed Data Sci"
Clinical-driven,"Univ New South Wales, Ctr Big Data Res Hlth"
Clinical-driven,"Icahn Sch Med Mt Sinai, Icahn Inst Data Sci & Genom Technol"
Clinical-driven,"Univ Manchester, Div Informat Imaging & Data Sci"
Clinical-driven,"Inst Stat Math, Dept Data Sci"
Clinical-driven,"Univ Texas Hlth Sci Ctr Houston, Dept Biostat & Data Sci"
Clinical-driven,"Chang Gung Mem Hosp, Ctr Big Data Analyt & Stat"
Clinical-driven,"UT Southwestern Med Ctr, Dept Populat & Data Sci"
Clinical-driven,"Xiamen Univ, Natl Inst Data Sci Hlth & Med"
Clinical-driven,"Peking Univ, Natl Inst Hlth Data Sci"
Clinical-driven,"Hasselt Univ, Data Sci Inst"
Clinical-driven,"NCI, Canc Data Sci Lab"
Clinical-driven,"Univ Liverpool, Dept Hlth Data Sci"
Clinical-driven,"Indiana Univ Sch Med, Dept Biostat & Hlth Data Sci"
Clinical-driven,"Chinese Univ Hong Kong, Stanley Ho Big Data Decis Analyt Res Ctr"
Clinical-driven,"Univ Michigan, Michigan Inst Data Sci"
Clinical-driven,"Hallym Univ, Hallym Data Sci Lab"
Clinical-driven,"Taipei Med Univ Hosp, Clin Big Data Res Ctr"
Clinical-driven,"Leiden Univ Med Ctr, Dept Biomed Data Sci"
Clinical-driven,"Univ Missouri, Inst Data Sci & Informat"
Clinical-driven,"Swinburne Univ Technol, Dept Stat Data Sci & Epidemiol"
Clinical-driven,"Dartmouth Coll, Dept Biomed Data Sci"
Clinical-driven,"Univ Amsterdam, Dept Epidemiol & Data Sci"
Clinical-driven,"Vrije Univ Amsterdam, Dept Epidemiol & Data Sci"
Clinical-driven,"Tokyo Med & Dent Univ, M&D Data Sci Ctr"
Clinical-driven,"INTI Int Univ, Fac Data Sci & Informat Technol"
Clinical-driven,"Taipei Med Univ, Grad Inst Data Sci"
Clinical-driven,"Sichuan Univ, West China Biomed Big Data Ctr"
Clinical-driven,"Natl Hlth Insurance Serv, Big Data Steering Dept"
Clinical-driven,"UNSW Sydney, Ctr Big Data Res Hlth"
Clinical-driven,"Res Org Informat & Syst, Joint Support Ctr Data Sci Res"
Clinical-driven,"Royal Coll Surgeons Ireland, Data Sci Ctr"
Clinical-driven,"Yokohama City Univ, Sch Data Sci"
Clinical-driven,"Nara Inst Sci & Technol, Data Sci Ctr"
Clinical-driven,"Sichuan Univ, Med Big Data Ctr"
Clinical-driven,"Fu Jen Catholic Univ, Big Data Res Ctr"
Clinical-driven,"China Pharmaceut Univ, Big Data Res Inst"
Clinical-driven,"Univ Chicago, Ctr Spatial Data Sci"
Clinical-driven,"Univ Kansas, Dept Biostat & Data Sci"
Clinical-driven,"Jichi Med Univ, Data Sci Ctr"
Clinical-driven,"Providence Univ, Dept Data Sci & Big Data Analyt"
Clinical-driven,"Natl Cerebral & Cardiovasc Ctr, Dept Data Sci"
Clinical-driven,"Yokohama City Univ, Grad Sch Data Sci"
Clinical-driven,"Amsterdam UMC, Dept Epidemiol & Data Sci"
Clinical-driven,"Queensland Univ Technol, Ctr Data Sci"
Computer-driven,"Shanghai Univ, Shanghai Inst Adv Commun & Data Sci"
Computer-driven,"Beihang Univ, Beijing Adv Innovat Ctr Big Data & Brain Comp"
Computer-driven,"City Univ Hong Kong, Sch Data Sci"
Computer-driven,"Guizhou Univ, Coll Big Data & Informat Engn"
Computer-driven,"Univ Technol Sydney, Global Big Data Technol Ctr"
Computer-driven,"Univ Granada, Andalusian Res Inst Data Sci & Computat Intellige"
Computer-driven,"Univ Elect Sci & Technol China, Big Data Res Ctr"
Computer-driven,"Foshan Univ, Sch Math & Big Data"
Computer-driven,"Chongqing Univ, Sch Big Data & Software Engn"
Computer-driven,"Chinese Acad Sci, Key Lab Big Data Min & Knowledge Management"
Computer-driven,"Beijing Jiaotong Univ, Key Lab Transport Ind Big Data Applicat Technol C"
Computer-driven,"Columbia Univ, Data Sci Inst"
Computer-driven,"NYU, Ctr Data Sci"
Computer-driven,"Yuan Ze Univ, Innovat Ctr Big Data & Digital Convergence"
Computer-driven,"Fudan Univ, Sch Data Sci"
Computer-driven,Shenzhen Res Inst Big Data
Computer-driven,"Chinese Acad Sci, Res Ctr Fictitious Econ & Data Sci"
Computer-driven,"Imperial Coll London, Data Sci Inst"
Computer-driven,"Penn State Univ, Inst Computat & Data Sci"
Computer-driven,"Nanjing Univ Posts & Telecommun, Jiangsu Key Lab Big Data Secur & Intelligent Proc"
Computer-driven,"Southwest Jiaotong Univ, Natl Engn Lab Integrated Transportat Big Data App"
Computer-driven,"Indian Inst Sci, Dept Computat & Data Sci"
Computer-driven,"Taiyuan Univ Technol, Coll Data Sci"
Computer-driven,"Fujian Univ Technol, Fujian Prov Key Lab Big Data Min & Applicat"
Computer-driven,"Qingdao Univ, Sch Data Sci & Software Engn"
Computer-driven,"Shandong Normal Univ, Inst Data Sci & Technol"
Computer-driven,"Beijing Technol & Business Univ, Beijing Key Lab Big Data Technol Food Safety"
Computer-driven,"Guizhou Univ, Guizhou Prov Key Lab Publ Big Data"
Computer-driven,"Hefei Univ Technol, Key Lab Knowledge Engn Big Data"
Computer-driven,"Chinese Univ Hong Kong, Sch Data Sci"
Computer-driven,Int Res Ctr Big Data Sustainable Dev Goals
Computer-driven,"Shenzhen Technol Univ, Coll Big Data & Internet"
Computer-driven,"Guizhou Univ, State Key Lab Publ Big Data"
Computer-driven,"Harbin Inst Technol, Inst Mat Genome & Big Data"
Computer-driven,"Anhui Univ, Natl Engn Res Ctr Agroecol Big Data Anal & Applic"
Computer-driven,"Guizhou Normal Univ, Sch Big Data & Comp Sci"
Computer-driven,"Henan Univ, Henan Key Lab Big Data Anal & Proc"
Computer-driven,"Maastricht Univ, Dept Data Sci & Knowledge Engn"
Computer-driven,"Shanghai Jiao Tong Univ, Shanghai Inst Adv Commun & Data Sci"
Computer-driven,"Univ Calif Berkeley, Berkeley Inst Data Sci"
Computer-driven,"Fudan Univ, Shanghai Key Lab Data Sci"
Computer-driven,"Chinese Univ Hong Kong, Shenzhen Res Inst Big Data"
Computer-driven,"Fuzhou Univ, Coll Comp & Data Sci"
Computer-driven,"Argonne Natl Lab, Data Sci & Learning Div"
Computer-driven,"Changsha Univ Sci & Technol, Hunan Prov Key Lab Intelligent Proc Big Data Tran"
Computer-driven,"Huazhong Univ Sci & Technol, Natl Engn Res Ctr Big Data Technol & Syst"
Computer-driven,"Shiga Univ, Fac Data Sci"
Computer-driven,"East China Normal Univ, Sch Data Sci & Engn"
Computer-driven,"Shenzhen Univ, Natl Engn Lab Big Data Syst Comp Technol"
Computer-driven,Natl Engn Lab Integrated Transportat Big Data App
Computer-driven,"Univ Sci & Technol China, Sch Data Sci"
Computer-driven,"Nanjing Univ Informat Sci & Technol, Jiangsu Key Lab Big Data Anal Technol"
Computer-driven,"Shanxi Univ, Inst Big Data Sci & Ind"
Computer-driven,"Univ Virginia, Sch Data Sci"
Computer-driven,"City Univ Macau, Inst Data Sci"
Computer-driven,"Southwest Univ, Chongqing Engn Res Ctr Remote Sensing Big Data Ap"
Computer-driven,Beijing Adv Innovat Ctr Big Data Based Precis Med
Computer-driven,Jiangsu Key Lab Big Data Secur & Intelligent Proc
Computer-driven,"Sejong Univ, Dept Data Sci"
Computer-driven,"George Mason Univ, Dept Computat & Data Sci"
Computer-driven,"Natl Univ Singapore, Inst Data Sci"
Computer-driven,"Fudan Univ, Shanghai Inst Adv Commun & Data Sci"
Computer-driven,Guangdong Key Lab Big Data Anal & Proc
Computer-driven,"Cent China Normal Univ, Natl Engn Lab Educ Big Data"
Computer-driven,Key Lab Oceanog Big Data Min & Applicat Zhejiang
Computer-driven,"North Univ China, Sch Data Sci & Technol"
Computer-driven,"Ton Duc Thang Univ, Div Data Sci"
Computer-driven,"Noroff Univ Coll, Dept Appl Data Sci"
Computer-driven,"Peking Univ, Ctr Data Sci"
Computer-driven,"Univ Lancaster, Data Sci Inst"
Computer-driven,"Asia Univ, Big Data Res Ctr"
Computer-driven,"Shenzhen Univ, Inst Big Data Intelligent Management & Decis"
Computer-driven,"Tsinghua Univ, Inst Data Sci"
Computer-driven,"Xi An Jiao Tong Univ, Natl Engn Lab Big Data Analyt"
Computer-driven,Jheronimus Acad Data Sci
Computer-driven,"Zhejiang Ocean Univ, Key Lab Oceanog Big Data Min & Applicat Zhejiang"
Computer-driven,"Hefei Univ, Sch Artificial Intelligence & Big Data"
Computer-driven,"Jinan Univ, Big Data Decis Inst"
Computer-driven,"Fujian Prov Univ, Key Lab Data Sci & Intelligence Applicat"
Computer-driven,"Univ Rochester, Goergen Inst Data Sci"
Computer-driven,"Zhejiang Lab, Res Ctr Healthcare Data Sci"
Computer-driven,"Huazhong Univ Sci & Technol, Hubei Engn Res Ctr Big Data Secur"
Computer-driven,"Islamic Azad Univ, Big Data Res Ctr"
Computer-driven,"Graz Univ Technol, Inst Interact Syst & Data Sci"
Computer-driven,"Case Western Reserve Univ, Dept Comp & Data Sci"
Mathematics-driven,"Nankai Univ, Sch Stat & Data Sci"
Mathematics-driven,"Yale Univ, Dept Stat & Data Sci"
Mathematics-driven,"Univ Texas Austin, Dept Stat & Data Sci"
Mathematics-driven,"Guizhou Minzu Univ, Sch Data Sci & Informat Engn"
Mathematics-driven,"Carnegie Mellon Univ, Dept Stat & Data Sci"
Mathematics-driven,"Anhui Univ Sci & Technol, Sch Math & Big Data"
Mathematics-driven,"Vilnius Univ, Inst Data Sci & Digital Technol"
Mathematics-driven,"Zhejiang Univ Finance & Econ, Sch Data Sci"
Mathematics-driven,"Renmin Univ China, Inst Stat & Big Data"
Mathematics-driven,"Univ Calif San Diego, Halicioglu Data Sci Inst"
Mathematics-driven,"Cent European Univ, Dept Network & Data Sci"
Mathematics-driven,"Cornell Univ, Dept Stat & Data Sci"
Mathematics-driven,"Shanxi Univ, Shanxi Key Lab Math Tech & Big Data Anal Dis Cont"
Mathematics-driven,"Southern Univ Sci & Technol, Dept Stat & Data Sci"
Mathematics-driven,"Jiaxing Univ, Coll Data Sci"
Mathematics-driven,"Zhengzhou Univ, Henan Acad Big Data"
Mathematics-driven,"Natl Univ Singapore, Dept Stat & Data Sci"
Mathematics-driven,"Minjiang Univ, Coll Math & Data Sci"
Mathematics-driven,"Henan Normal Univ, Henan Engn Lab Big Data Stat Anal & Optimal Contr"
Mathematics-driven,"Osaka Univ, Ctr Math Modeling & Data Sci"
Mathematics-driven,"Yonsei Univ, Dept Stat & Data Sci"
Mathematics-driven,"Zhejiang Univ, Ctr Data Sci"
Mathematics-driven,Beijing Inst Big Data Res
Mathematics-driven,"Guizhou Univ Finance & Econ, Coll Big Data Stat"
Mathematics-driven,"North Minzu Univ, Key Lab Intelligent Informat & Big Data Proc Ning"
Mathematics-driven,"Natl Cheng Kung Univ, Inst Data Sci"
Mathematics-driven,"Shandong Univ, Data Sci Inst"
Mathematics-driven,"Shaanxi Univ Sci & Technol, Sch Math & Data Sci"
Mathematics-driven,"Nanjing Audit Univ, Sch Stat & Data Sci"
